Processed_Text,Word_Count,Lexical_Diversity,Score
يوم ديسمبر، سجل ميس هدف فوز مبارا نهاييهلكاس عالم لاند عام نادياستوديانتيس دي لاتافيابوظبي، يمنح ناد قبه سادس هذا عاموبعد يومين، حصل علىجايز افضل اعب ره قدم عالم، يهزم منكريستيانو رونالدووتشاف هيرنانديزوريكاردو اكاواندريس انيستاللحصول جايز كان هذه مره اولى يفوز ها ميسي، يصبح اول ارجنتين يحصل شرف منذ ابتكار جايزهف يناير سجل ميس اولهاتريكل عام اول هاتري موسم ضدتينيريفيبالفوز نتيج ،وف يوم يناير سجل هدف ميو ناد مبارا فوز علىناد اشبيل,88,0.8522727272727273,10.0
دا ميس مسار رايع تسجيل هدف خمس مباري اول سجل دقيق امامناد مالقابالفوز ،ثم سجل هدف ضدالميرياف مبارا تعادل تابع تالق اسبوع مثير لاعجاب سجل ثمان اهداف؛ دا تسجيلههاتريكامامناد النسيابفوز ذهاب سجل هدف مرمىشتوتغارت، مبارا فوز ضمن برشلون تاهل دور ربع نهاي مندور ابطال اوروبا،واخير سجلهاتريكاخر ضدريال سرقسطهف فوز نتيج ايابا،ليصبح اول اعب برشلون يسجلهاتريكمتتال دور اسبانيلعب مبارات رسم رقم رشلون ضداوساسونايوم مارس,76,0.8157894736842105,10.0
انه افضل اعب عالم فارق جيد انه مثلالبلا ستيش يمكن استفاد خطا نرتكب,16,0.9375,10.0
اغسطس سجل ميس هاتري اولى دايت هذا موسم فوز نتيج علىاشبيليهفيكاس سوبر اسباني، يساعد رشلون تام اول قاب موسم خسار مبارا ذهاب نتيج ما دا موسم دور هدف، سجل مرور ثلاث دقايق قط ضدراسينغ سانتاندرف اغسطس تابع تالق مبارا مرحل مجموعاتبدور ابطال اوروباضدباناثينايكوسحيث سجل هدفين، صنع اثن اخر ما امكان تسجيل هدف ايض,65,0.8307692307692308,10.0
سبتمبر تعرض ميس اصاب كاحل سبب تتدخل متعمد مدافعاتلتيكو مدريدتوماش اويفالوشيف دقيق مبارا جول ثالث علىملعب يسينت الدير اول هله يخشى ان ميس تعرض كسر كاحل يمك ان تبعد اعب نجم ملاعبمد تقل سته اشهر، اظهر تصوير الرن مغناطيس يوم تال انه تعرض التواء اربط داخل الخارج كاحل ايم قطوقال زميل ديفيد يا مشاهد لقط تدخل ميس حشيا، اضاف ايض انه يعتقد ان مدافع اتليتيكو يتدخل ايذاء ميسيوتسبب حادث اهتمام سايل اعلام نطاق اسع طرح مناقش مساوا حما جميع لاعب مباري,104,0.8076923076923077,10.0
سبتمبر، اعل رشلونه، لمر ثان غض ثلاث اشهر، تجديد عقد ميس حتى شهر يونيو عام في هذه مره حسب اجرت اجر اعب اساس فريق اولحصل ميس جنس اسبان سبتمبر سنه ،ليتمك اخير لعب اول مره اول موسم يالدور اسبان جرت اول مبارا ميس ارض ملعبالكامب نوفيدور ابطال اوروبابتاريخ سبتمبر نفس عام، نادياودينيزيالايطاليلوحظ مدى اعجاب مشجع ميسي، عندم قامو التصفيق حفاو الغ حظه استبداله، قدم مبارا انسجام معرونالدينيو، مما ادى وز برشلون,89,0.8426966292134831,10.0
احرز ميس سته اهداف مبارا دور اسباني، سجل هدف احد دور ابطال اوروب سته مباري انتهى موسم مبكر مارس عندم تعرض تمزق عضل خذه ايم مبارا اياب دور ثان دور ابطال اوروب ضدتشلسيومع انهى رشلون موسم بطل اسباني اوروب,50,0.82,10.0
يموسم رض ميس نفس لاعب اساس لفريق اول، تسجيل هدف مباراهف نوفمبر، خلال مبارا ناديريال سرقسطه، اصيب ميس كسر يمشط قدم، ابعد ملاعب طيل ثلاث اشهرتعافى ميس اصابت ارجنتين، جاء عودت لعب ضدراسينغ سانتاندرف براير،حيث دخل لقاء لاعب ديل شوط ثان مارس، شهدالكلاسيكوميس قمه مستواه، احرازههاتريكواهدا رشلون تعادل اتى تعادل اخير وقت محتسب دل ضايعوبذل اصبح اول اعب، منذايف زامورانولريال مدريدف موسم يسجل هاتري كلاسيكوكم اصبح اصغر اعب تاريخ يحقق امر بقرب نها موسم دا هز شبا خصوم اكثر اكثر؛ تمك تسجيل هدف اصل دور لموسم اخر مبارا,107,0.8130841121495327,10.0
ضمنموسم سجل ميس خمس اهداف غض اسبوع يقود رشلون مراكز اربع اولى دور اسبان يوم سبتمبر سجل مره عندم هزم رشلونهليونبنتيج ارض مباراهدور ابطال اوروباسجل هدف مرمىاشبيليهف سبتمبرثم سبتمبر، سجل ميس هدف اخر مبارا فوز علىريال سرقسطهوجاء هدف تال مبارا اياب الفوز ضدناد يفانتيف سبتمبر هدف ثان يدور ابطال اوروبالهذ موسم جاء ضدناد شتوتغارت، في براير، عب ميس مبارات رسم ميه قميص رشلون ضدناد النسي,75,0.7733333333333333,10.0
رشح ميس جايزهاتحاد لاعب محترف تشكيل عامف يه هجوم،واظهر استطلاع لرا اجر علىالانترنتلصحيفهماركاالاسبانيه، ان معظم معجب صوتو ميس يك افضل اعب عالم، حصل اصواتذكر محرر صحف تابع برشلونه، مثل صحيفتيال موندو ديبورتيفووسبورت، ذكرو انه يجب ان تعطىالكر ذهبيهلميسي، هو راي ايدهفرانز يكنباوركذل صرح مخضرم ره قدم، مثلفرانشيسكو توتي، انه يعتقد ان ميس احد افضل اعب ره قدم حالي عالمغاب ميس مده سته اسابيع ملاعب اثر اصاب مارس، عندم تعرض تمزق عضل خذه ايسر مبارا دور ابطال اوروب امامناد سيلتي كان هذه مره رابع ثلاث مواسم يعان يها ميس نوع اصابهبعد عودت اصاب سجل ميس هدف اخير موسم ضدفالنسياف مايو يفوز رشلون نتيج انتهاء موسم تمك ميس تسجيل هدف صنع هدف جميع بطول,136,0.8382352941176471,10.0
رحيلرونالدينيوع نادي، رث ميس قميص حامل رقم اكتوبر مباراهدور ابطال اوروباضدشاختار دونيتسك، سجل ميس هدف دقايق سبع اخيره، نزول ديلالتيير هنري، يقلب نتيج وز برشلونهكان مبارا دور قادم ضداتلتيكو مدريد، مبارا صفت مثاب معرك ديه ميس صديق حميمسيرجيو اغويروسجل ميس هدف ركل حره، صنع اخر يما تقدم رشلون الفوز المبارا احرز ميس هدف اخر مثير لاعجاب اشبيل تسجل تسديد متر يارد من دحرج كره حارس مرمى تسجيل زاو ضيق لطرف اخرف ديسمبر اول لاسيكو هذا موسم، سجل ميس هدف ثان مبارا از ها رشلون ريال مدريد،كم حصل مركز ثانيلجايز افضل اعب عالم سنه ستما ثمان سبع نقط,119,0.8403361344537815,10.0
سجل ميس اول هاتري ثلاث اهداف مبارا احد عام مباراهكاس ملك اسبانياضد اتلتيكو مدريد از ها رشلون نتيج سجل ميس هدف اخر مهم براير نزول ديل شوط ثان يساعد رشلون هزيم راسينغ سانتاندر نتيج ان كان هدف ثان هدف رقم برشلون دوريف جول ثامن العشر دور اسباني، سجل ميس هدف ثلاث هذا موسم جميع بطولات، يساعد ريق لفوز نتيج علىناد مالقاف ابريل سجل مرت ضدباير ميونيخف دور ابطال اوروبا، يسجل رقم قياسي شخصي ثمان اهداف بطولهف ابريل، حقق ميس هدف عشر دور هذا موسم الفوز مضيف خيتاف يسمح برشلون الحفاظ ارق ست نقاط صدار جدول دور عنريال مدريد,119,0.7142857142857143,10.0
اقتراب نها موسم رشلونه، سجل ميس هدفين، يتوج الفوز ريال مدريد ملعبسانتياغو رنابيو،وقد اعتبر هذه هزيم اقسى ريال مدريد منذ عام ،وبعد تسجيل هدف، ميس يركض نحو جماهير ال تصوير يرفع قميص ليعرضقميصاخرى تب عل اي مرض متلازم اكس هشه، اظهار دعم لاطفال يعان مرض,53,0.9622641509433962,10.0
ظهر ميس غلاف عبه فيديوبرو ايفولش سوكر برو افلوش سوكر شار ايض حمل ترويج لالعابيعتبر ميسي، جانبفرناندو توريس،وجه عبهبرو افلوش سوكر قد شار ايض تقاط حرك الاعلانومع ذلك، نوفمبر قدم ميس الوج جديد لمنافس اولللبرو ايفولش سوكرف مجموع عاب فيديو كره قدمفيفاف اول ظهور نجم غلاف سلسل قادم يفا ستري ترعى ميس شرك المان رياضيهاديداسويظهر اعلان تلفزيون خاص همف يونيو قع ميس ايض عقدامد ثلاث سنو هرباليفي،الت تدعم ذلك موسس يو ميس,83,0.8192771084337349,10.0
تنافس ينكريستيانو رونالدووليونيل ميسيهو تنافسبكر قدمب مشجعيالبرتغاليكريستيانو رونالدووالارجنتينيليونيل ميس يفترض لاعب انفسهم ايض بعد ان حصلو رات ذهب ميس رونالدو، يعتبر لاهم افضل اعب جيلهم من افضل لاعب عبر تاريخ لا لاعب قد سر حاجز هدف موسم احد، سجلو اكثر هدف مسيرتهم ناد المنتخبكم انهم ايض لاعب وحيد لذ سجلاهاتريكسبع مر يدور ابطال اوروباالصحفي نقاد المشجع جدل دايم مزاي فرد كل منهم محاول تحديد يعتقد انه افضل اعب ره قدم وقت حاليوتم تشبيه مقارنتهم بعضهم مقارنهمحمد عليوجو ريزرفيالملاكمه، منافسهبيور ورغوج ماكنروفيالتنسومنافس ايرت سيناال روس يفورمول لسيار,101,0.8613861386138614,10.0
ره سلههيرياض جماعيهوشعب يتنافس يها ريق يتالف منهم خمس اعب يحاول لاهم ادخال كره سله خصم احراز اهداف كسب نقاط,24,1.0,10.0
يتم احراز نقاط ادخال كره داخل سله موجود ارتفاع امتار؛ يفوز فريق يتمك احراز عدد نقاط اكبر تلك يحرز منافس نها مبارا هكذ من صعب قوع نتيج تعادل فريق يمك لاعب تقدم الكر امام طريق تنطيط ارضالملعبفيم يعرف اسم مراوغ او تمرير زملا لوصول هدف لا يسمح اي احتكا دني يعرقل اي اعب فريق خطا هنا قيود مفروض يف تعامل كره تعرف اسم مخالف قواعد لعب,84,0.8571428571428571,10.0
ارتكاب لاعب ـست مخالف يطرد مباشر مبارا يعوض اعب اخر نفس فريق,15,0.9333333333333333,10.0
بمرور وقت، تطور عبه ره سله تشتمل طرق عب نيه شايع تتعلق تصويب كره تمرير المراوغ ها، جانب مراكز لاعب الخطط دفاع الهجوم عاد يلعب اطول اعب فريق مركزالوسطاو احد مركزيالهجوم، اما لاعب اقصر طول او يتميزونبالسرعهويمتلك افضلمهاراتف امساكبالكرهوالتحكم ها يلعب مراكزالدفاع على رغم اهتمام بالغ قواعد قوان عبه ره سله ممارست مسابق المنافسات، قد ظهر كثير العاب مشتق عبه ره سله الت تمارس شكل غير رسم في بلدان، تعد عبه ره سله رياض شعب تستقطب قطاع جماهيري بير,94,0.8404255319148937,10.0
في حين تعد ره سله اساس مثابهرياضهتنافس تمارس صالات، يملعب ره سله، قد ازداد انتشار العاب مشتق عبه ره سله، الت يتم تشديد يها قواعد القوانين، نوع رياض تمارس ساح خارج موجود القرب منالاحياء شعبيهوالتجمعاتالسكن ريف,44,0.8409090909090909,10.0
يوم سبتمبر سجل ميس هاتري وز ارجنت وليفي ضمنتصفي اس عالم يتجاوزبيليهويصبح افضل هداف دول امريك جنوب هدف,23,0.9565217391304348,10.0
سبتمبر، سجل ميس ثلاث فاز منتخب ارجنت ارض وليفي يتصفي اس عالم مما جعل يتفوق ايض علىبيليهبصف افضل هداف دول امريك جنوب رصيد هدفاف نهاييفيناليسيم نسخ ثالث منكاس ابطال ونميبوليويفا، يويمبليف يونيو ساعد ميس مرت تمرير حاسم انته الفوز ايطالي حامل لقب نسخ سابق اختير افضل اعب مباراه، محقق منتخب ارجنت قب مستوى درج اولىثم تبع ميس يونيو تسجيل اهداف منتخب خمس ضداستونياوالت انته نتيج متجاوزافيرين وشكاشب افضل هداف ره قدم مستوى رجال اطلاق,91,0.7802197802197802,10.0
انضم يونيل ميس تشكيل لاعب يكاس عالم كره قدم قطر استطاع ميس مبارا افتتاح تسجيل اول اهداف بطول ركل جزاء لكن انته هزيم منتخب ارجنت امامالمملك عرب سعوديهسجل مبارا منتخب تال ضدالمكسيكبضرب منخفض يارد الت ازت يها ارجنت اخر مبارا هم دور ضداستراليا، سجل ميس هدف افتتاح انته فوز ارجنت يما ظهور رقم مسيرت كرويه، اصبح ايض لاعب اكثر ظهور ره قدم امريك جنوب ونمبول، متجاوز رقم قياس سابق سجل لاعب اكوادوريايف هورتادو، جنب جنب تجاوز عده سجل اخرى مرتبط كاس عالم المنتخب وطن معادلت,102,0.8235294117647058,10.0
اثن ابناء عمه يلعب ره قدم ايضا، هماماكسي، يلعب جناح نادياوليمبيام باراغواي،وايمانويل يانكوتشي، يلعب لاعب خط سط لناد اسبانيغيرون,22,0.9090909090909091,10.0
مارس عين ميسيسفير لنواي حسنهلليونيسيف،وذل هدف دعم حقوق طفل دعم ناد رشلون ميس هذا، يتمتع ايض علاق قو يونيسيف,23,0.9565217391304348,10.0
مارس عام صنفتهمجل رانس وتبولعلى قمه قايم اغنى اعب ره قدم عالم، تسع عشر مليونجن استرلينيف جمع ايراد ات رواتب، مكاف الارباح خارج ملعب،ف سبتمبر عام اعل موقع سبوكسالالمانيب ثرو ميس تقدر نحو مليونيورو،وف تقرير مال حديث ذكرتمجل رانس وتبولالت تصدر يفرنسا ميس اعلى اعب ره قدم دخل سنه اذ لغ مجموع دخل لاعب تلك سنه ملي يورو، هذا دخل عبار مجموع راتب لاعب ناد رشلون المكافي عقودالدعايهقبل خصمالضرايبوالالتزام اجتماع,83,0.8433734939759037,10.0
ان منع ميس لعبللارجنتينفيدور العاب اولمب صيف عام ،وافق ادار ناد رشلون ترك يرحل ان تفاهم مدرب مع حديثاجوسيب غوارديولاانضم ميس تشكيل ارجنت سجل هدف اول فوز علىساحل عاجثم سجل هدف اول، صنعلانخل دي مارياف شوط ثان يقود ريق الفوز وقت اضاف علىهولنداوظهر ايض مبارا ارجنت منافسهالبرازيل، ازت ها ارجنت نتيج بالتال تقدم مبارا نهاي مبارا ميدال ذهبيه، صنع ميس مره اخرى دي ماري هدف مبارا وحيد فوز علىنيجيري,85,0.8235294117647058,10.0
عب ميس ارجنت مبارا افتتاح اكملها، قاد منتخب لفوز نتيج ضدنيجيري عده رص لتسجيل كنفانس انيامااوقف مرار تكرارابد ميس مبارا ارجنت تال الفوز علىكوري جنوبيه؛ قد شار جميع اهداف ريق ساعدغونزالو هيغواينبتسجيلهاتريكف مبارا ثالث الاخير مرحل مجموع ميس قايد لارجنت مبارا فوز علىاليونان، مره اخرى مركز نقط عب ارجنت كانرجل مبارا,61,0.8032786885245902,10.0
يدور سته عشرصنعلكارلوس تيفيزليسجل هدف اول مبارا فوز ضدالمكسي احتسب حكم هدف رغم انه انتسللواضحانته طول اس عالم لارجنت خسار امامالماني,25,0.96,10.0
شار ميس طولهكوب امريك يالارجنتين، يسجل اي هدف لكن صنع ثلاث اهداف اختير رجل مبارا مبارات وليفي كوستاريك خرج ارجنت دور ربع نهاي يركل ترجيحيهضدالاوروغوا قت اضافي، سجل ميس اول ركل ترجيح,38,0.9473684210526315,10.0
منع اصاب ميس عب اولى مباري ارجنت يكوب امريك ميويهوالت از ها ارجنت نتيج اماممنتخب تشيل في مبارا ثان اماممنتخب نما، دخل ميس بديل دقيق مبارا سجلهاتريكلتنته مبارا نتيج تتاهل ذلك ارجنت ربع نهايي،وف دور ربع نهاي احرز ميس هدف صنع اخر مبارا منتخب لاد معمنتخب نزويلاوالت انته ،وف دور نصف نهاي قاد ميس منتخب لاد تجاوزمنتخب ولاي متحدهوالوصول نهاي بطول لمر ثان توال فوز نتيج هدف ميس احرز تلك مبارا هدف رقم منتخب لاد جعل يتجاوز لاعب سابقغابرييل اتيستوتاكهداف تاريخ منتخب ارجنتين،قبل ان يخسر نهاي ضدمنتخب تشيليبركل ترجيح انتهاء مبارا قتي اصل الاضاف التعادل سلب ضيع ميس ركل ترجيح اسند ركل ترجيح,121,0.743801652892562,10.0
مارس اوقف ميس اربع مباري دول سبب سبه مساعد حكم مبارا ضدتشيليف مارس غرم مبلغ رنك سويسريف اكتوبر قاد ميس لاد لتاهللكاس عالم تسجيلههاتريكبعد ان ارجنت خاسر مبارا انته فوز رفقاء ميس علىالاكوادور قد ارجنت لقاء تهزم اكوادور يكيتومنذ عام اهداف ميس ثلاث جعلت هداف تاريخ يتصفي ونميبول موهل كاس عالم رصيد هدف، جانبلويس سواريزمنالاوروغواي، متفوق رقم قياس سابق سجل مواطنههرن رسبو,77,0.8571428571428571,10.0
بطوله، صرح ميس انه يشار مباري ديه لارجنت ضدغواتيمالاوكولومبياف سبتمبر علق انه سيك غير مرجح ان يمثل لاد فتر متبق سنه تقويم اثار غياب ميس منتخب وطن اخفاق مستمر فوز لقب ارجنت تكهن سايل اعلام ان ميس قد يعتزل ره قدم دول مره اخرىف مارس استدع منتخب ارجنت مره اخرى لمشارك مباري ديه فريق ضدفنزويلاوالمغربف قت احق شهرعاد لساح دول مارس، مبارا هزيم مبارا ود امامفنزويلا، يمدريد,88,0.7954545454545454,10.0
سبتمبر اعلنالاتحاد ارجنتين كره قدمان رفع ايقاف ميس مبارا احد انه سيك متاح لعب تصفي شهر مقبلف سبتمبر، استدع ميس تشكيل ارجنت تصفي اس عالم ضدالاكوادوروبوليفياف اكتوبر,29,0.9655172413793104,10.0
ان سجل هدف قدم تمرير حاسم مستوى ناد المستوى دول لعام تقويم مساعد ارجنت فوزبكوب امريك نوفمبر، حصل ميس علىالكر ذهب سابعهكم اصبح ثان اكبر اعب عام يوم يفوز جايز كره ذهب,38,0.9473684210526315,10.0
ظهر ميس اول مره منتخب ارجنت سنه شهر يونيو عام، يمبارا ديهضدالباراغوايف سنهك جزء فريق از بطولهكاس عالم لشباب سنهفيهولندا، ازبالكر ذهبيهوالحذاء ذهبي،بتسجيل مباري اربع اخير لارجنت احراز مجموع سته اهداف بطول,42,0.9285714285714286,10.0
عب اول مبارا دول امل اغسطسسن ضدمنتخب مجرف سن ثامن عشر نزل بديل دقيق كنه طرد دقيق ان راى حكم،ماركوس ميرك، انه نطح مدافع يلموس انتشاك، يسحب قميص ميس كان قرار مثير لجدل ادعىمارادوناايض ان قرار متعمدوعاد ميس لفريق يوم سبتمبربخسار ارجنت ضمنتصفي اس عالمخارج ارض امامالباراغوا قال مبارا هذه اعاد اول ظهور، الاولى قصير قليلاثم خاض اول مبارا ارجنت ضدمنتخب بيرو، بعد مبارا صف يكرم ميس انه جوهر,82,0.8414634146341463,10.0
مارس سنه تصفي موهل نهايي اس عالم ضدفنزويلا، ارتدى ميس قميص رقم اول مره ارجنت كان هذه مبارا رسم اولىلدييغو مارادوناكمدرب لارجنت ازت ارجنت نتيج مبارا بافتتاح ميس تسجيل,34,0.8529411764705882,10.0
نوفمبر سجل ميس هدف لحظ اخير منافس امريك جنوبيالبرازيلبعد مجهود ردي يساعد ريق الفوز نتيج يمبارا ديه، عبت يالدوح كان هذه مره اولى يسجل ها امام برازيل مستوى كبارسجل ميس هدف اخر اخر حظه براير ضدالبرتغالم ركل جزاء اعط ريق فوز نتيج يمبارا ديه، عبت يجنيف،سويسر,55,0.8,10.0
عب ميس مبارا اولى يكوب امريك يونيو نفس عام، عندم هزمتالارجنتينالولاي متحدهبنتيج مبارا اولى هذه مباراه، اظهر قدرات صانع عاب، اذ صنع هدف زميل مهاجمهرن ريسبو، العديد تسديد مرمى دخلتيفيزبديل ميس دقيق سجل يما,43,0.8604651162790697,10.0
مبارا ثان ضدمنتخب ولومبيا، حصل يها ركل جزاء حول ريسبو تعادل نتيج ما عب دور هدف ارجنت ثان عندم تمت عرقلت خارج منطق جزاء، مما اتاحلخو روم ريكيلميبالتسجيل ركل حره، تصبح غله ارجنت كان نتيج نهاي لمبارا صالح ارجنت تضم ها مكان دور ربع نهاي بطول,55,0.9090909090909091,10.0
مبارا ثالثه، ضدالباراغواي، اراح مدرب ميس تاهل الفعل دور ثمانيه، دخل مقاعد بدلاء مكاناستب امبياسوف دقيق حينم نتيج تزال دقيق صنع هدفلخافيير ماسكيرانوف دور ربع نهايي، يما اجهتالارجنتينالبيرو، سجل ميس هدف ثان مباراه، اثر تمرير ريكيلمي، تفوز ارجنت نتيج مبارا دور نصف نهاي ضدالمكسيك، سجل ميس ره ساقط وق اوسفالدو سانشيز تصل ارجنت مبارا نهاي وزهم نتيج قد خسر ارجنت امامالبرازيل مبارا نهاي,78,0.7948717948717948,10.0
