Processed_Text,Word_Count,Lexical_Diversity,Score
تعرضتتقن فارالحديث كثير انتقادات، خاص مبارياتالمجموع ففي مباراهاسبانياوالبرتغال، ضحت اعاد تلفزيون عدم صحه هدفدييغو وستابعدم عرقل برتغاليبيبي، يد ان حكم يلج تقن فاروف مباراهايرانضدالبرتغالرفض حكم مبارا باراغويانيانريك اسيريساستخدام تقن فيديو امام مطالب اعب مدرب منتخب اير ركل جزاء سيود احتساب تسجيل هدف من اقصاءالبرتغالوتصدرايرانالمجموعهوف مبارا اخرى يناسبانياوالمغرب، اعتراض اكثر صراحه، ان قرر حكم ساح اوزبكيرافش ايرماتوفاستخدام تقن فار لتاكد صحه هدف تعادل منتخباسبانياوالذ سجل دقيق مباراه، ان رفع حكم مساعد رايت معلن تسلل، حكم قرر ان هدف صحيحهاجم عديد لاعب المدرب تقنيه، صرح اعبالمنتخب مغربينور دين امرابطوهو يوج لم لجماهير قايل ان تقن فيديو عبار هراء، يما اعتبر مدربمنتخب ايرانالبرتغاليكارلوس يروشقايل ان تقن فيديو تمتل اسس اضح استخدام,125,0.808,10.0
لفت فيف صنع ديل لكاس طول استلم فيف عرض تقديم مننحاتونم سبع دولوقام لجن اختيار فنانالايطاليسيلفيو غازانيغالشرف صناع كاس جديده، لغ ارتفاع كاس مقترح سم وصه يتك جم رطل ذهب عيار نسب قاعد قطر سم وصه مكتوب علي اس عالم كره قدم الت تحتو طبقت منالمرمر، اكد مارت وليكوف ان كاس مجوف لكن مت انه اذا مصمت سيك زنه جم سيك ثقيل جدا لحمل,73,0.8904109589041096,10.0
تم صناع كاس يبيرتونيبميلانو مدينهباديرنو دونيانو، وصل زنه كلي جم يصور اثن شخصي بشر يمسكالارض صف جازانيج كره تصميم كاس ان خطوط ربيع خارج قاعد ترتفع شكللولبي، تمتد يد خارج كي تلمس عالم صور فكر شكل اثن رياضي حظه نصر، لغت تكلف انشاء هذه كاس قت دولار، اصبح قيمت حال تعادل ملاي دولار,64,0.875,10.0
يتم نقش اسم فريق فايز البطول خلف كاس تبدو غير مري اذا حمل كاس امام ينقش اسم عبار السن لغه فايز،مثال البرتغال الالمانيه، حتى طول لغت عدد اسماء محفور قاعد ايز يعرف احد حتى ان مستقبل كاس ان تمتل منطق اسماء قاعدته، هذا غالب يحدث حتى نهايي طوله، تنص وايح فيف ان ان كاس حال عكس سبق يمك امتلاك مدى حياه، يحتفظ فايز البطول الكاس اصل مده سنو يحصل عد نسخ طبق اصل منه مطل الذهب يحتفظ ها مدى حيا,98,0.8061224489795918,10.0
تميمهاوالتعويذهبالانجليز عبار مجسم او دم شخص او حيو او كا يستخدم شعار لبطول رياضيه، تستخدم تمايم بطول رياض عموم اغراض ترويج تسويقيه، الاضاف كون تطف جوا مرح البهج جماهير تستخدم ذلك مقاطع رسوم متحرك او عروض تلفزيون تستخدم تمايم ايض لقيام جول خير,49,0.8571428571428571,10.0
مصطلحالتعويذهبالانجليز يرجع نطق فرنس كلم الفرنس يكاس عالم تم اختيار تميم اتخد مسوول انجليز اعضاءالاتحاد دول كره قدمقرار وضعتميمهخاص الكاس ترمز رمز انجليز خالص، فكرو وضع تميمهالاسد يليوتعتبر هذه تميم اول تميم كاس عالم هي احد تمايم اولى تترافق منافس رياض كبرىوالتصاميم تميم تظهر رموز يمثل ميز لبلد مضيف حلي، نباتات، حيوانات،,59,0.9322033898305084,10.0
اخر تميم استخدم هيزابيفاكاالروس الانجليز تميم طولهكاس عالم يروسي هو عبار حيوانالذيبذو صوف بني الابيض ابس قميص عبار روسي ضع ازال نظار رياض برتقاليه، هي نظاراتالتزحلق ثلجحسب ثلج يعم ارضموسكووقد استخدم مزيج وانالابيضوالازرقوالاحمرف باس تميم لدلال الو وطنيهللمنتخب روس صمم تميم طالب روس ايكاترين وشاروفا،وتم اختيار تميم طريق تصوي علىالانترنت، بمشارك اكثر ملي مصو,66,0.8939393939393939,10.0
رات اس عالم كره قدمهيالكر رسميهالمستخدم مباري اس عالم كره قدم، يتم تخصيص ره محدد بتصميم مع كل طول حدى اصبح حالي روتكول رسم اي طوله، قرر اتحاد دول كره قدم استخدام ره قدم موحد معتمد بطول اس عالم عقب خلاف شهير حدث نهاي اول كاس عالم بالتحديد ينهاي اس عالم عندم عب نهاي كرت نتيج خلاف فريقين، كره اولى منالارجنتينواسم تايننتو كان منتخب ارجنتين متقدم في شوط ثان قدم مستضيفالاوروغوايكر اخرى اكبر حجم اثقل، تنته مبارا فوزمنتخب اوروغوايبنتيج عد قررالاتحاد دول كره قدماستخدام ره احد رسم معايير محدد دءا طولهكاس عالم اصبح كره تستخدم جميع مباري بطول,110,0.7909090909090909,10.0
في عام، تم اختياراديداسكمصنع رييس قايم رات اس عالم، اصبح رات بطول تصميماديداسم طولهكاس عالم غا يومن هذا،عندم اعلن رهاديداس تيليستار، الت استخدم طولتيكاس عالم كاس عالم تم استخدام رهتانغوف طولتيكاس عالم ،وكاس عالم ان جاء طولهكاس عالم اعلن شرك المان اول ره اس عالم اصطناع الكامل اول ره يتم خياطت اليد، اطلق علي اسمازاتيك في طولهكاس عالم تم شف ستار رهايترسكو يونيكو، رهكويسترافيكاس عالم,73,0.7397260273972602,10.0
تنظيم طول اس عالم تمنح اثناء انعقاد موتمر عامللاتحاد دول كره قدم اختيارالدول مستضيفهتثير جدل دوم اختيار مك ستلعب يه نهايي امر صعبا، تبلغ رحل منامريك جنوبيهالىاوروبااكثر ثلاث اسابيع، علاو ان محصور دول قارهاوروبام ناح دول قارتيامريك شماليهوالجنوبيهم ناح اخرى سبيل مثال ان منح شرف استضاف بطول اولى ىالاوروغوايساهم مشارك منتخب اوروب قطالبطولت تاليت اقيمت اوروب بطول ثالث منح استضافت ىفرنساسنهكان مثار جدل ان اتحاد امريك تطالب المداور ين بين نظراي اوروب مما جعلالارجنتينوالاوروغوايتقرر مقاطع بطول,92,0.9021739130434783,10.0
عدالحرب عالم ثانيهوتحديد عدكاس عالم لتجنب حدوث مشكل اخرى، قررالاتحاد دول كره قدمالمداور دولاوروباوامريكا، الذ استمر حتىكاس عالم حتى قامتاليابانوكوري جنوبيهبتقديم طلب مشتر استضاف نهايي عام، بذل اصبح تلك بطول اول طول تقام قارهاسيا،وكاس عالم يجنوب افريقياهو بطول اولى تقام يافريقيانظام اختيار تغير نظام تصوي سري عبر لجن تنفيذ تابعهللاتحاد دول كره قدم يتم اتخاذ قرار منح استضاف دا بطول سبع سنو رغم انبطول تم اختيار التزام اختيار مستضيفبطول,79,0.8860759493670886,10.0
دول نال شرف استضاف مرت هيالمكسيك،فرنسا،ايطاليا،والمانيا،والبرازيلملعب ازتيكاالذ يقع مدينهمكسيكوالوحيد استضاف مبارا نهاي مرتينملعب ماراكاناف مدينهريو دي جانيرواصبح ملعب ثان يستضيف مبارا نهاي مرت نها طولهكاس عالم اولى يكاس عالم رغم ان نظام بطول وقت يكن يه مبارا نهاي ختام,52,0.8846153846153846,10.0
في تصوي طولتيوك تصوي دول اتحاد قار احده، تم اقام طولهكاس عالم يامريك جنوبيه، هي مره اولى تقام يامريك جنوبيهمنذكاس عالم عامصوتاتحاد امريك جنوبيهلمنحالبرازيلالثق استضاف اس عالم، لكن عامقررتكولومبياالدخول منافس استضافهكاس عالم قد منح لجن تنفيذ تابع لاتحاد دوليروسياشرف استضافهكاس عالم هذه مره اولى تستضيف روسي نهايي تنافستروسياعلى استضاف معانكلتراوملف مشتركلاسبانياوالبرتغالواخرلهولنداوجارتهابلجيكاكم منح لجن تنفيذ تابع لاتحاد دول كره قدم قطر شرف استضافهكاس عالم هذه مره اولى تستضيف هادول عربيهومنالشرق اوسطحق استضاف اس عالم,81,0.7037037037037037,10.0
اس طول اس عالمهو اسذهبييكاف فايز بطول اس عالم قدم حتى ان اس مختلف لفايز البطول منذ دايت عاموهم اسجول ريميهم عامالى عام،وكاس طول اس عالمم عامحتى ان اول اس قدم اس نصر احق اعيد تسميت اسم رييسالاتحاد دول كره قدمالفرنسيجول ريميهباعتبار اب روح لبطول صاحب كرت تكريم هفازتالبرازيلبالكاس يالى ابد مما دفعالاتحاد دول كره قدمالى انشاء اس ديل لكن عامسرق اسجول ريميهولم تستعاد قط كاس حال يسمىكاس فيف بطول اس عالمبالانجليز قدم عام هو مصنوع قيراطذهبمع قاعد مرمر يصور شخصيت بشر يحملانالكر ارضيهوالفايز حالي هوالمنتخب ارجنتينيف,97,0.8350515463917526,10.0
تعتبركاس جول ريميهاول اس يستخدم اس عالم اصل يسميبكاس نصر، لكن سمي كاس عالم الفرنس تم تبديل اسم رسمي عام، تكريم دور رييسالاتحاد دول كره قدمالفرنسيجول ريميهالذ سعى جهود مضن احياء بطول مره اخرى العمل انطلاق اثناء عامصمم كاس واسطهابيل افلورالذ صنع منالذهب خالصذو قاعد منالرخام ابيض،وقد تم تصميم كاس تمثال مجنح الال نايكالمعروفبال نصرعنداليونان، تحمل راس قدر ذهب رمز تتويج فريق منتصر البطول,74,0.9054054054054054,10.0
اثناءالحرب عالم ثانيهوحينم كاس حوزهالمنتخب ايطاليالفايز النسخ ثالث عام قام اوترينو راس نايب رييسالاتحاد دول كره قدمورييساتحاد ايطالي كره قدمبنقل كاس سرا نك يروماوخبا علب احذ سرير منع قو متحارب استيلاء عليه،وبعد تم اخراج كاس عامليذهب ىسويسراالت تستضيف بطول قتهاف مارس، قبلكاس عالم اربع شهور يانجلتراسرقتكاس جول ريميهم معرض عام قاعهمنستيرالمركزيه،ثم عثر عل اسبوع سرقت ملفوف يصحيفه، اسفل سياج حديق احد ضواح نوروود جنوبلندن، عثر عل لب مسمى بيكلز,84,0.8928571428571429,10.0
في عامفازالمنتخب برازيليبالبطول لمر ثالثه، مما سمح هم طبق لقوان نص عليهاجول ريميهفي، الاحتفاظ الكاس حقيق لابدوضع كاس مقراتحاد برازيل كره قدمالذ يقع يريو دي جانيروداخل ابين امام زجاج مضاد لرصاص لكن ديسمبر، سرق كاس كابين لمر ثان سرقت عامم اربع رجال محكوم عليهم غيابي لم يتم استعاد هذه كاس غا ان,59,0.9322033898305084,10.0
دور ابطال اوروبابالانجليز الت يشار يها عادهبدور ابطالفقط الانجليز طولهكر قدماوروب سنو ينظمهاالاتحاد اوروب كره قدممنذ عاملافضل اند ره قدم ياوروب,24,0.9583333333333334,10.0
تعد هذه بطول اهم طول يكر قدمعلى مستوى اند عالم،اذ تعد مبارا نهاي لبطول اكثر احداث رياض سنو مشاهد جميع انحاء عالم، هي تجذب اكثر ملي مشاهد تلفزيون,32,0.90625,10.0
بطوله، عام، تسمى رسمياكاس اند اوروب بطله، في عاد يشار يها اسمكاس اوروبااوكاس ابطال اوروب كان بطول بدا نظام خروج مغلوب كان يلعب يها طل دور كل دول قط اضاف حامل لقب يشار نسخ تال لدفاع قبه دات بطول تتوسع سنه، تم دمج مرحل مجموع ذهاب اياب زياد عدد فرق في عامتحول اسم جديد الحال دور ابطال اوروب تم زياد عدد فرق حتى اصبح بطول حالي مكون نادي تبد نسخ جديد دور ابطال اوروب يموسم,87,0.8390804597701149,10.0
عامقرر اتحاد اوروب كره قدم منح حامل قبالدور اوروبيمقعد اضاف دور ابطال خلاف مقاعد طولت محل ذلك هدف رفع اهم بطوله، مما جعلاشبيليهيتاهللدور ابطال رغم شله حصد احد مراكز اربع موهله، يصبح دور اسبان ثان دور تاريخ بطول يشار اند دور مجموعات، علم ان اول دور شار خمس اند هوالدور انجليزيفيموسم عندم شاركليفربولحامل قب مقعد اضاف عدم تمكن تاهل عبر اربع مراكز اولى دور محل,74,0.8648648648648649,10.0
از اللقب نادي مختلفا، منهم از اللقب اكثر مره يعدريال مدريدالناد اكثر وزا اللقب،حيث از البطول مره،ويحمل قب بطول حالياباريس سان جيرمانالفرنس عدم از اللقب موسمعقب وزه علىانتر ميلانالايطال نتيج مبارا اقيم ملعباليانز ارينافيميونخ، هي اكبر هزيم تاريخ نهاي دور ابطال اوروب,48,0.875,10.0
يعود فضل لاد مسابق دور ابطال اوروبا، صحافي رنسي انو يعمل يصحيف يكيبالرياض فرنسيه،وعلى راسهم غابريال هانو اقترح انشاء اس اوروب لاند عام، تب زميل جاك دو ريزوي مقال يقترح يه مشروع اس اوروب لانديه، لاقى اقتراح ردود عل ايجاب يالقار عجوز، تبع قيام جاك ير يكيب ايض كتاب مسودهلنظامالبطول ان ثانيينايرم عام، فياليوم ثالث شباطفبرايرم عامنشرتالصحيفهالفرنس قايم اسماء اند خوض نسخ اولى اس اوروب لاند لبت هذه اند دعوه، خصوص انالاتحاد دول كره قدملم يمانع انشاء مسابق ان افق مشروع مقدم منالصحيف,96,0.875,10.0
دات بطول عام مسمى اس اند اوروب ابطال، عاد يشار يها اسم اس اوروب او اس ابطال اوروب كان بطول بدا نظام خروج مغلوب، كان يلعب يها طل دور كل دول قط دات بطول تتوسع سنه تم دمج مرحل مجموع ذهاب اياب زياد عدد فرق,52,0.8653846153846154,10.0
اكثر لاعب تسجيل هاتري مبارا احد مجريساندور وشيتشفيكاس عالم الفرنسيجاس ونتينفيكاس عالم الالمانيجيرد مولرفيكاس عالم ،والارجنتينيغابرييل اتيستوتافيكاس عالم كاس عالم لاعب سجلو هدف اقل مبارا اس عالم هم اوروغويانياليسيدس غيغيافيكاس عالم عندم سجل اربع اهداف اربع مباريات، الفرنسيجاس ونتينمنمنتخب رنس كره قدمفيكاس عالم البرازيليجارزينيوفيكاس عالم عندم سجل سبع اهداف ست مباري,63,0.6984126984126984,10.0
اصغر لاعب تسجيل لاهداف ايرلند شمالينورم يتسايد، عمر سنه يوم مبارا منتخب لاد ضدمنتخب يوغوسلافيافيكاس عالم ينم يعتبر برازيليبيليهاصغر لاعب سنا تسجيل لاهداف نهاي اس عالم، عمر سنه يوم مبارا منتخب لاد ضدمنتخب سويدفينهاي اس عالم ،يل فرنسيكيلي مبابيوالذ سجل هدف ينهاي اس عالم كان عمر انذا سنه يومااكبر لاعب سنا تسجيل لاهداف، كاميرونيروج ميلا،الذ سجل هدف مبارا منتخب لاد ضدمنتخب روسيافيكاس عالم كان عمر سنه يومابينم اكبر لاعب تسجيل لاهداف نهاي اس عالم، سويدينيلس يدهولم، سجل هدف مبارا منتخب لاد ضدمنتخب برازيلفينهاي اس عالم كان عمر سنه يوم,109,0.44036697247706424,10.0
اسرع هدف يتاريخ اس عالماحرز تركيهاك شوكوربعد مرور ثانيه، مبارا منتخب لاد معمنتخب وري جنوبيهضم مبارا تحديد صاحب مركز ثالث يكاس عالم ينم اسرع هدف ينهاي اس عالمسجل هولندييوه نيسكينزبعد مرور ثانيه، مبارا منتخب لاد ضدمنتخب ماني كره قدمف نهاييكاس عالم,43,0.7441860465116279,10.0
اكثر حراس مرمى شاركو مباري لم يسجل مرماهم اي هدف هما انجليزيبيتر شيلت الفرنسيفابي ارتيز واقع مبارياتبينم يمتل ايطاليفالتر زينغاالرقم قياس اكبر عدد دقايق عب حارس مرمى ان يسجل مرما هدف، واقع دقيق يكاس عالم اقل حراس مرمى ازو بطول دخل اهداف مرماهم هم فرنسيفابي ارتيزفيكاس عالم الايطاليجانلويج وفونفيكاس عالم عدم انقذ هجم مرماه،والاسبانيايكر اسياسفيكاس عالم ،حي يدخل مرماهم سوى هدف قط,78,0.782051282051282,10.0
اسرع اعب تم طرد اس عالم هوخوس اتيستامنمنتخب اوروغوا كره قدمفيكاس عالم ثان قطبينم يتشار فرنسيز دين زيدانوالبرازيليكافوف انهم اكثر لاعب حصول طاق اس عالم، حصلز دين زيدانعلى طاقات، ينم حصلكافو طاقات، اكثر لاعب حصول طاق حمراء هماوز دين زيدانمنمنتخب رنس كره قدم،وريغوبر سونغمنمنتخب كامير كره قدم، حصل رت احمرينف جهه اخرى ان كاميرونيريغوبر سونغهو اصغر اعب حصل طاق حمراء يتاريخ اس عالمحيث يبلغ عمر عام,80,0.75,10.0
احدى عشر طول سابق طول اس عالم، از اللقب اعب اكثر لاعب وزا لقب اس عالم برازيليبيليهوالذ از ها مر اعوام و، ينم اعب ازو اللقب مرتينكذل يعتبر برازيليبيليهاصغر لاعب تحقيق كاس عالم عندم حققكاس عالم كان عمر سنه يومابينم يعتبر ايطاليدينو زوفاكبر لاعب تحقيق كاس عالم عمر سنه يكاس عالم,59,0.7457627118644068,10.0
عشر نسخ ماض طول اس عالم، از مدرب مختلف اللقب يعتبر ايطاليفيتوريو وتسوالاكثر نجاح تاريخ بطوله، هو وحيد از لقب متالي يومعمنتخب ايطاليابينم يعتبر برازيليماريو زاغالوهو انجح اطلاق وزه لقب بطول مرات، مرت لاعب معمنتخب برازيلف عاميووكمدرب هم عام، كمساعد مدرب يول يشار احدماريو زاغالوالرقم المانيفرانز يكنباورالذ حقق قب بطول مرتين، اولى لاعب عاموالثان مدرب ي،وكذل فرنسيديدي ديشامبالذ حقق قب بطول مرتين، اولى لاعب عاموالثان مدرب ييعتبر المانيهيلمو شوناكثر مدرب مشارك اس عالم، قادمنتخب ماني كره قدمب عاميو،وهو ايض اكثر مدرب وزا واقع انتصاراام النسب لانتصار متتال هو نصيب برازيليلويس يليب سكولاري، از مبارا متتال منتخبيالبرازيلفيوالبرتغال,111,0.8018018018018018,10.0
ايض هنال مدرب ازو اللقب مره، حققو مركز ثان هم؛ المانيهيلمو شونفاز اللقب ي، حل صيف الالمان اخرفرانز يكنباورفاز اللقب ي، حل صيف ي، الارجنتينيكارلوس يلاردوفاز اللقب ي، حل صيف اخرهم برازيليماريو زاغالوفاز اللقب ي، حل صيف اما اكثر مدرب مشارك هو برازيليكارلوس برتو يريراالذ درب سته منتخب هممنتخب كويتف عام،منتخب اماراتف عام، فاز اللقب معمنتخب برازيلف عام،منتخب سعوديهف عام،ومنتخب برازيلف عامومنتخب جنوب افريقياف عاميليهبور ميليتونوفتشوالذ درب خمس منتخب هممنتخب مكسيكف عامومنتخب وستاريكاف عامومنتخب امريكاف عامومنتخب نيجيرياف عام،ومنتخب صينف عامبينم اصغر مدرب شار اس عالم ارجنتينيخو خوس تراموتولامدربمنتخب ارجنتينفيكاس عالم عمر سنه يومبينم اكبرهم المانياوتو ريهاجلمدربمنتخب يونانفيكاس عالم عمر سنه يوم,115,0.6869565217391305,10.0
تهيم قارتااوروباوامريك جنوبيهعلى منافس اس عالم، لم يخرج لقب تلك قارت منذانشاء بطوله، يتمك اي ريق خارج تلك قارت التاهلللمبارا نهاي ثم منتخب استطاع فوز لقب اس عالم، منهم قارهامريك جنوبيهوهمالبرازيلوالارجنتينوالاوروغوايو قارهالاوروبيهوهمايطالياوالمانياوانجلتراوفرنساواسباني خلال نسخ نسخ اس عالم حقق منتخب اوروب قبا، مقابل حقق منتخب امريك جنوب قاب تكرر حال استضاف منافس منذ نشات عام تقم بطول خارج قارت عاماقيم بطول اول مره قارهامريك شماليهوتحديد يالمكسيك،تلت ايض اعوامفيالمكسيك،وفيالولاي متحد امريكيهوبعد اقرار فيف مبد مداور تنظيم اس عالم، استضاف دول اسي هيكوري جنوبيهواليابانمنافساتكاس عالم ،واستضافتجنوب افريقيامنافساتكاس عالم ،وتبقى ذلك قارهاوقيانوسياالوحيد تستضف عالي منافس,109,0.7614678899082569,10.0
شهد نسخ احدى العشر سابق طول اس عالم وز ثمان منتخب مختلف اللقب ما سجلللمنتخب برازيليحضور بطولات، هو يغب ابد اي طول اس عالم حتى ان هو اكثر تتويج الكاس از ها خمس مر اعوام،و،و،وو يليهالمنتخب ايطاليالذ احرز اربع مر اعوام،و،وو، المنتخبالالمانيالذ احرز اربع مر اعوام،،و،و منتخب ارجنتين ثلاث مر اعوام از منتخب اوروغوا كره قدموالمنتخب فرنسيباللقب مرتين، حي ازتالاوروغوايبلقب عامو، فاز ذلكفرنسابلقب عامو جهه مقابله، ازت منتخباتانجلتراواسبانيابلقب بطول مره احد ازتانجلترابلقب عام، ينم ازتاسبانيابلقب عام,90,0.8555555555555555,10.0
