Processed_Text,Word_Count,Lexical_Diversity,Score
تم ابتكار عبه ره سله لمقعد قدامى محاربى حرب عالم ثان ذوي احتياج خاصه،وه عبه تتم ممارست راس متحرك يتم تصميم خصيص من يعان اعاق دنيهيذكر ان جهه عالم تسيطر ره سله لمقعد اتحاد دول كره سله لمقعدينعلى جانب اخر، تلعب ره سله ماي داخل حمام سباحه، تتشكل قواعد منظم ها مزيج قواعد عبت ره سله كره ماءام ره سله شاطي هي عبه تتم ممارست داخل ملعب مستدير جود وح خلف مثبت هدف، لا يتم تطبيق قاعد تجاوز كره حدود ملعب تناقل كره تمرير او تقدم ها نحو خطوت نصف، ذلك ان تنطيط كره ارض ينه امر شبه مستحيل,115,0.7652173913043478,10.0
ثمه ايض عديد العاب اخرى مشتق عبه ره سله تتم ممارست اطر غير رسم جود حكام او قواعد صارمهولعل عبهكر سله مقام نصف ملعب احد قطه لعب وحيد مشتق اكثر شيوعاحيث يتم استخدام سله احد قط، يتع رمي كره عيد طريق تمرير او تنطيط خارج خط نصف ملعب او خط ثلاث نقاط مره تنتقل يها حياز كره ريق اخر تتطلب ممارس هذه لعب قوه تحمل اقل تتعلقبالقلبوالاوع دمو من ياق دن اقل؛ نظر انه يس مطلوب لاعب قطع ملعب له عدو جي ذهاباكم ان هذه لعب ايض تزيد عدد لاعب يمكنهم استفاد ملعب، هي ميز مهم عندم يكثر عدد لاعب يرغب ممارس عبه كره سله,122,0.7704918032786885,10.0
ثمه عاب اخرى مشتق ره سله تتضم عبه لعب خروج مهزوم هي عبه مشتق ره سله يمارس لاعب محترف لعب عالم هي عبه مشتق يشار يها اعب او اكثر يقوم تصويب تسديد سله نقاط معينه، من ينجح اصاب هدف يظل يتنقل نقط معين اخرى، الذ يصل نقط نها يعتبر ايز لعب اعب مقابل اعب هي عبه مشتق يستخدم يها اعب اثن جزء صغير قط ملعب غالب يزيد نصف ملعب ينافس لاهم اخر احراز كره داخل طوق سله احد تركز هذه العاب مرواغ فرد الكر خطف منافس اكثر تركيز مهار تسديد اللعب جماع,111,0.7387387387387387,10.0
رابط وطن كره سلهبالانجليز تعرف اختصار اسم ايبالانجليزيه، تسمى ايض اسمالدور امريك كره سله لمحترفين، اتحاد اكثر احتراف لعبهكر سله، احد اكبرالدوري رياضيهفيامريك شمال يتالف دور ثلاث نادي، تسع عشر من منالولاي متحدهوناد احد منكنداهوناد تورونتو رابتورز,40,0.95,10.0
تاسس دور يمدين نيويوركف يونيو،وعرف انذا اسماتحاد رابط امريك كره سله عام تم اندماج يناتحاد رابط امريك كره سلهالمعروف اسم الانجليز بين غريمهاتحاد دور وطن كره سلهالمعروف اسم الانجليز يعل رسمي لادهالرابط وطن كره سلهوالذ يختصر اسم الانجليز يذكر ان ره سله احد اكثر رياض شعب ينالرياض ولاي متحد,54,0.7592592592592593,10.0
اكثر اند وزا اللقب هوبوسط سيلتيكسبرصيد طول يليهلوس انجلوس يكرزوالذ يمتل طول ايض,13,0.9230769230769231,10.0
تبد عبه تنس رصيد كل اعب، عند تسجيل اول نقط يصبح رصيد يسمى بعد تسجيل نقط ثان يصبح رصيد بعد نقط رابع يصبح رصيد في حال صول لاعب معا ان نتيج تسمى تعادل بعد يفوز لاعب تزيد نقاط نقاط خصم نقطت متتاليت شوط، من جدير الذكر انه مباري رجال يجب لاعب فوز ثلاث اشواط اصل خمسه، اما مباري نساء يجب فوز شوط اصل ثلاث,80,0.7125,10.0
يبلغ طول ملعب قدم متر يبلغ عرض قدم متر مباري فرد قدم متر مباري زوج حاج مساح اضاف اضح ملعب كي يتمك لاعب وصول كر متجاوز تمتد شبك عبر عرض كامل لملعب، التواز خطوط اساس، تقسم طرف متساوي يتم تثبيت اما طريق ابل معدن او سلك يمك ان يزيد سم وصه يبلغ ارتفاع شبا اقدام وص عارضت اقدام مركز,77,0.8311688311688312,10.0
ره تنس مطاط خفيف وزن لون اصفر شكل داير هي مكسو اللباد كره ذات شكل خارج منتظم، ان يضاء او صفراء، ان اقسام متصل دون خيوط، ان يتراوح قطر سم سم، اما زن ينبغى ان يتراوح غرام غرام,45,0.8222222222222222,10.0
لاعب اللاعب عشر اوايل حسب تصنيف عالم قد يتجدد تصنيف لاعب اللاعب يوم اثن حسب زياد او نقص نقاط لاعب اللاعب يتم زياد او خصم نقاط حسب بطول حصل علي,32,0.78125,10.0
معرف قيه مصنف التصنيف جديد يصدر يوم اثن زيار موقع رابط لاعب محترف,15,1.0,10.0
معرف قيه مصنف التصنيف جديد يصدر يوم اثن زيار موقع رابط لاعب محترف,15,1.0,10.0
مصدرسبحسبحبـ سبحف رياض دن معروف ها وايد مباريات سباحهلمساف طويل,10,1.0,10.0
يتك ريق كره طاير اعبا، رسمي احتياط، مدرب مساعد مدرب، مدرب ياقه، طبيب رياض,16,0.9375,10.0
ره مضرباوالتنس ارضيف ترجم حرف نوع منرياض راحوالت يتنافس يها اعب مباري رديه، او ريق مكون اعب مباري زوجيهكل منهم يحملمضرباليستخدم ضربالكرهفوق شبك نحو منطق خصم عدد ضرب يس محددا، انم نتيج تحدد رابح,38,0.9210526315789473,10.0
ره مضرب او تنس هورياضهاولمبيهتلعب جميع مستوي مجتمع فيات لجميع اعمار، يمك اي شخص ان يمس مضرب يضرب كره ما ذوو احتياج خاصهومستخدمو كراس متحرك نش عبه تنس حديث يبرمنغهامبانجلتراف اواخرالقر تاسع عشركرياض تلعب عشب، ذا هي ثيق صله كل العاب ميدانيهكالكريكتوالبولينغ، اضاف رياض مضرب قديم,52,0.9423076923076923,10.0
تغير قواعد ره مضرب حديث قليل منذ تسعيني قرن تاسع عشر، استثناء قاعدت لاعب ان يضع قدم احد ارض جميع اوق مباراه، في سبعيني اعتمد شوط فاصل تاي ريك من اضاف حديث لعب مستوى احتراف اعتماد تقن مراجع الكترون عين صقر جانب نظام تحد نقاط,54,0.9074074074074074,10.0
يلعب ره مضرب ملاي اعبين، هي رياض مشهور منتشر جميع انحاء عالم، تحظىالبطول كبرى كره مضرببمتابع جماهير اعلام بيره، تضع مرتب متقدم احداث رياض اكثر اهم متابع عالم سنوي اهم هذه بطولاترول غاروساوبطول رنس مفتوحهعلى ملاعب رمليه،بطول استرالي مفتوحهعلى ملاعب صلبه،بطول يمبلدونعلى ملاعب عشبيه،وبطول ولاي متحد مفتوحهعلى ملاعب صلب,54,0.8703703703703703,10.0
تمارس عاد هواء طلق ملاعب داخل مغلق انم يتبارى هذه لعب شذا راس يضو شكل مشدود الاوتار هو يقذف ره مطاط مكسو اللباد الهدف لعب تسجيل نقاط ارسال كره منطق خصم حيث يعجز رد او حيث يرد لكن ان تمس ارض اكثر مره، او ارسال منطق خصم اكراه رد نحو تمس معه شبك او تقع خارج حدود ملعب اهم يميز عبه تنس غير قيه العاب اخرى ان تفيد اجزاء ثير جسم ضلا توافق تتطلب ممارس لعب ذهن كاف عضل جسم,100,0.82,10.0
ره متوسط اصغر ره قدم اخف زنا من وزن كره جرام جرام محيط كره سم سم ضغط هواء داخل كره جمسم,28,0.6428571428571429,10.0
يجب لاعب ان يتمك ضرب كره ساح خصم مك احد او شخص مباشره، تك اكثر ضرب تاثير عندم تهي كره احد اعضاء فريق مهاجم يقوم اخير ضرب سرع ايق دقه عال,39,0.8974358974358975,10.0
يحصل فريق نقط عندم ينجح رمي كره وق شبك تلامس ارض ساح خصم، او عندم يرتكب فريق خصم خطا، او عندم يحصل فريق خصم عقوب اي نوع انتاذ رمي فريق كره خارج ارض خصم تحسب نقط لفريق اخر,42,0.6666666666666666,10.0
يحسب خطا فريق عندم يقوم اي اعضا تصرف مخالف قواعد لعبه، او مناف لاخلاق رياض يك حكم مسوول تقييم درج خطااذ تم ارتكاب خطا او اكثر التعاقب، يحتسب خطا اول قط اذا ارتكب اي فريق خطا او اكثر شكل متزام يتم احتساب خطا مزدوج ضده، يعاد ارسال يمنع مس شبك لا يحسب اي شيء عندم تلمس كره شبك,62,0.8225806451612904,10.0
يحصل فريق نقط اذا نجح تمرير كره ساحت ساح خصم لم يستطع خصم ردها، يواصل ارسال ان يستطيع فريق خصم رد كره يحصل نقط ينتقل ارسال يه يفوز فريق الشوط عدا شوط خامس حاسم، اذا حصل نقط بتقدم يقل نقطتين، مثل في حال تعادل فريق كل منهما، يستمر شوط مبارا ان يتقدم احد فريق النقطت مطلوبتين، يفوز او سبيل مثال للفوز المباراه، يتع احد فريق ان يفوز اربع اشواط، اذا تعادل فريق تحسم مبارا اللجوء شوط خامس حاسم نقطه، يتع ان يتقدم فايز نقطت اقل,102,0.7058823529411765,10.0
يلعب مدافع حر ليبرو خط خلفي، يمتل تحكم دقيق كره، يجب ان مدافع حر مرسل مدافع ارعا، يجب ان يتحر جميع انحاء ملعب؛ هدف ابقاء كره هواء، عدم سماح سقوط ارض ملعب حتى يحتسب هدف لفريق خصم,44,0.8409090909090909,10.0
كره طايرهبالانجليز احدى اكثر رياض عالم شعب يلعب يها ريق تفصل ينهم شبك عال فريق ضربالكرهفوق شبك منطق خصم كل ريق ثلاث محاول ضرب كره وق شبك تحسب نقط لفريق حينم تضرب كره ارض خصم، او اذا تم ارتكاب خطا، او اذا اخفق فريق صد كره ارجاع شكل صحيح,52,0.8653846153846154,10.0
اول دول مارس لعب عدالولاي متحد امريكيهكانتكنداف عام تعد هذه رياض ان اكثر رياض شعب يالبرازيل، معظم دولاوروباوبالاخصايطالياوهولنداوصربيا، الاضاف ىروسياوبعض دول قارهاسي,24,1.0,10.0
برايرعامم، مدينههوليوك،ماساتشوستسانشاويليام جورج مورغانمدير ترب بدن اتحاد عبه رياض جديد اطلق علي اسممينتونيتلتمض وقت شكل مسل، فضل ان تمارس هذه لعب داخل صال باي عدد لاعب اخذ لعب عضا خصايص منالبادمينتون،التنسوكر يد، وقت يهكر سلهرياض جديد تم انشاء ره طاير اساس ان رياض داخل اقل خشون ره سله مناسب اعضاء اتحاد,61,0.8360655737704918,10.0
قوان اولى لرياض ابتكر ليام اشترط جود شبك ارتفاع م، سط ساح لعب يجب ان طول معلى عدد لاعب محدد، يتبار مبارا مكون استقبال ارسال كل ريق حتى عامملم تصنع ره خاص كره طاير كذل تكن قوان لعب تلك فتر الشكل نعرف يوم اول عرض لعب عاماستبدل اسم رياض وليبول معنى ره طاير حال من طرا رياض عديد تغيير قواعد ما حال ره سله,84,0.8809523809523809,10.0
تاسس اتحاد عالم كره طاير عام، اول طول عالم لرجال اقيم عام، ينم اول طول عالم لسيد عام اضيف كره طاير ىالالعاب اولمبيهف عامالاوليمب اول مره طوكيو، كان منذ حين رياض رييس تلك دور تم انشاء رياضهالكر طاير شاطييهعاموالت تعد رياض مشابه ره طاير عاد حد بير رغم اختلاف عدد لاعب اضيف كره طاير شاطي رنامج العاب اولمب صيف عامفياطلانط,71,0.7605633802816901,10.0
تتك منطق لعب ملعب المنطق حره يجب ان منطق لعب مستطيل متماثل,14,0.8571428571428571,10.0
ملعب مستطيل شكل، طول ثمان عشر مترا، عرض تسع امتار، تخطط ارض خطوط اضح عرض سم، يقسم ملعب قسم مربع متساويين، طول ضلع مربع تسع امتار، يفصل ينهم خط منتصف يرسم مساف ثلاث امتار خط منتصف جانب خط مواز خط منتصف، يقسم مربع منطقتين، تسمى منطق قريب شبك المنطق هجوميه، المنطق ثان منطق دفاع تحدد منطق ارسال خط طول سم يبعد خط نها سم، يفضل ان تلعب كره طاير صال مغلق ارتفاع سقف يقل سبع امتار,88,0.8181818181818182,10.0
اعوام مدينهليفربولتستضيف تنظم عاب اولمب سنو ابتكر هذه العاب جون هول تشارلز ميلي، كان اول عاب خاص الرياضي هواه، كذل ذات طابع دوليك رنامج اول اولمبياد حديث اثين عام مطابق تقريب برنامج اولمبياد يفربولف عام اسس لا يليام روكس، جون هول ارنس جورج رافنشتا جمع اولمب وطن يفربول، الت تحول يما ىالجمع اولمب بريطان مواد بنود تاسيس جمع دور بارز ضع اطار عملالميثاق اولمب دوليبعد تاسيس جمع عام تحديد عام تم تنظيم دور عاب اولمب طن ريطاني عظمى يكريستال الاسبلند,95,0.8105263157894737,10.0
عام حضربيير دي وبرتاندور العاب اولمب جمع ينلو اولمبيه، همت تاسيساللجن اولمب دول قد نى وبرت افكار روكس زاب تهدف انشاء دور عاب اولمب دول تقام اربع سنو قدم وبرت هذه افكار خلالالموتمر اولمبيالاول لجن اولمب دول منشا حديث عقد اجتماع فتر يونيو يجامع اريس في يوم اخير موتمر، تقرر ان تقام اول دور عاب اولمب رعا لجن اولمب دول اثين عام انتخب لجن اولمب دول كاتب يونانيديمتريوس يكيلاسكاول رييس ها,86,0.7674418604651163,10.0
مسابق تتابع مم يمك قول ان مسابق تتابع عاد قديم ارسال رسايل طريق عديد سعاه، يقوم ساع تسليم رسايل شخص يل حتى يتم وصول نقط نهاي مسابق تتابع اربع عداي لد، يقوم عداء تغط ربع مساف عدو تسليم عصا متسابق يل عمل تبادل عصا لاعب ها قوانين تكتيكات خاص يجب ان يتم تبادل مك محدد,72,0.7777777777777778,10.0
يتم دفع كره حديد منطق داير قطر تزن كره حديد خاص الرجال جم ينم كره حديد خاص النساء تزن,22,0.7727272727272727,10.0
العاب اولمبيهالحديث الفرنس احداثرياضيهدول تشمل مسابق رياضيهصيفيهوشتويه، يشار يهارياضيونم لا جنس منافس مختلف يمثل فود مختلف جميع انحاء عالم تعتبر العاب اولمب منافس رياض اولى عالم مشارك اكثر دولهحيث ينظم حدث حالي سنت سنواتالزوجيه، تناوبالالعاب صيفيهوالشتويهبعد ان تقام لتا مسابقت اربع سنوات، في نفس سنه حتى عام تسمى تره اربع سنو سنو دوراتباولمبياد,64,0.890625,10.0
استلهم انشاي منالالعاب اولمب قديمهبالاغريق تعقد ياولمبيا، يونانم قرن ثام ميلاد قرن رابع ميلاد اسسالبار يير دي وبرتاناللجن اولمب دول عام عبرالكونغرس اولمبي، قاد هذه لجن تنظيم اول دور عاب اولمب حديث ياثيناعام اللجن اولمب دوليهه هي ادار لحرك اولمبيه، يحددالميثاق اولمبيهيكلت سلطت,50,0.94,10.0
تتك حرك اولمب اتحاد رياض دول ،واللج اولمب وطنيه، اللجن منظم دور العاب اولمب مزمع انعقاد لجن اولمب دول صفت هي صنع قرار ان مسوول اختيار مدين مضيف كل دوره، كذل هي تنظم تمول العاب فقا لميثاق اولمب تحدد لجن اولمب دول ايض برنامج اولمب يتك منالالعاب رياضيهالت سيتم تنافس علي دور لالعاب اولمب يشمل احتفال الالعاب اولمب عديد طقوسوالرموز اولمبيه، مثلالعلم اولمبيوالشعل اولمبيه، الاضاف ىحفل افتتاح الختام تنافس اكثر رياض يالالعاب اولمب صيف الالعاب اولمبيهالشتو مجتمعه، رياض مختلف اكثر حدثيحصل فايز المركز اول الثان الثالث حدث علىميدالي اولمبيه، يتوج رياض حاصل مركز اولبالميدال ذهبيه، الثانيبالفضيه، الثالثبالبرونز,110,0.8272727272727273,10.0
يهيم جدول العاب اربع انواع احداث ملتقي كبرى، الملتقي انديه، البطول وطنيه، البطول دول كبرىالالعاب اولمبيهه حدث اكثر شهر دوليا، هي تعقد اربع سنو منذ عام، تليهابطول عالم العاب قوىالت تعقد سنت منذفيم اول دور سنه منذ سنه، احداث عاب قوى تنظم طرفالاتحاد دول العاب قوى,55,0.8545454545454545,10.0
جرت مسابق عاب قوى اول مره لاداليونانسن قم نطاق العاب اثين طليع دور اولمب كان هذه رياض تمارس احتفال دينيه، اكتسب طابع روحي اضاف بعد رياضي، ابتداء سنه قم كان اساس العاب اولمب قديم اقتصر دور ثير عاب حد,48,0.8541666666666666,10.0
مصطلح عاب قوى يضم مجموع متنوع انشط تنقسم قسم رييسي عالي تقام داخل ملعب هواء طلق او داخل صال مثلالعدو،الرمي،القفز فعالي تقام خارج ملعبكالماراثونوالمشي،والعدو ريف,28,0.9285714285714286,10.0
سباحهالمتزامن سباح توقيع رياض الترب بدن رياض يقوم ها سباح او مجموع سباح اداء حرك راقص مصاحب لموسيقىالمعجم لغه عرب معاصر,21,1.0,10.0
دور انجليز ممتازبالانجليز هودوريكر قدمللقسم اول يانجلتراوقد استخدم مسمى دور ممتاز سنهم، يعتبر اعلى مستوى يكر قدم انجليز يتك دور ريق ينطلق دور شهراغسطسوينته شهرمايو، يلعب ريق مباراه، يصبح مجموع مبارا موسم واحد، تلعب معظم مباري يوميالسبتوالاحد، لكن عدد قليل مباري تلعب امسي منتصف اسبوع,53,0.8301886792452831,10.0
حتى عام اعلى درج ره قدم انجليز درج اولى؛ منذ حين، اصبح دور انجليز ممتاز اعلىفشكل مسابق دور انجليز ممتاز براير، قرار اند درج اولى انفصال دور درج اولى، تاسس عام، ذلك لاستفاد صفق مربح حقوق بث تلفزيون من حين اصبح دور انجليز ممتاز اكثر دور مشاهد عالم، هو ذلك اكثر دور ره قدم ربحا، ذلك ايراد اند مجتمع لغت ملياردولارف موسم هو ذلك صاحب مركز اول ترتيبالاتحاد اوروب كره قدمللدوري اداء بطول اوروب خمس سنو ماضيه، متفوق علىالدور اسبانيوالدور ايطال,100,0.76,10.0
منذ دا نظام حال لبطول عام، من مجموع نادي نافس دور انجليز ممتاز، سبع اند قط ازو اللقبمانشستر يونايتد قب،مانشستر سيت قاب،تشيلس قاب،ارسنال قاب،بلاكبير روفرزلقب احد،ليستر سيتيلقب احد،ليفربوللقب حامل لقب دور حال هومانشستر سيت,37,0.8918918918918919,10.0
تم تشكيلمسابق دور انجليز ممتازف برايروالذ حل محل دور انجليز لمحترف موسم هذه خطو تاريخ تعن تغيير نظام طول استمر سنه تغيير نظام يحتو دور اربع درج كان خطو هذه تعزيز ره قدم انجلتر معانا منتصف ثمانين ضعف امكاني ماد مشاكل مشاغب ره قدم انجليز,53,0.8679245283018868,10.0
لقد تم اول اجتماع توقيع ميثاق بطول يوليو بعد اتفاق انشاء دور دات عمل بحث رعا لبطول اصدار ترخيص خاص لبث تلفزيون مايو تم اشهار دور ممتاز شرك تعمل التعا اتحاد انجليز كره قدم,41,0.9024390243902439,10.0
تم اعل اكتوبر الذ صف خطه اعاد توحيد افضل اند دور انجليز دور ره قدم انجليزيه، الت اقترح اند دور انجليز ممتاز مثل مانشستر يونايتد ليفربولوقد تعرض انتقاد قياد دور انجليز ممتاز وزار ثقاف الاعلام الرياض تابع حكوم مملك متحد,45,0.8666666666666667,10.0
ابريل تم ايقاف لعب مبارا يستر سيت كريستال الاس لسماح لاعب يسل وفان شيخو ويات الافطار رمض يعتقد ان هذه مره اولى تاريخ دور انجليز ممتاز يتم يها ايقاف مبارا موقت لسماح لاعب مسلم تناول طعام الشراب غروب شمس فقا قواعد عقيد,51,0.8823529411764706,10.0
قانون رسمي اصلي لعبه، من يتضم شروط مباد توجيه صمم هذه قوان تناسب جميع مستوي ره قدم، تعديل تناسب في ناس مثل اطفال الناشي النساء الناس يعان اعاق جسد هذه قوان غالب تصاغ عبار عامه، مما يتيح مرون تطبيق اعتماد طبيع لعب تسهر فيف تطبيق قوان لعبه، رغم ان ذكر وضع مجلس اتحاد دول كره قدم الاضاف قوان سبع عشر، تلعب قرار توجيه مجلس اتحاد ايض دور تنظيم هذه رياض,91,0.8351648351648352,10.0
دا طول دور ايطال تاسيس اتحاد كره مارس رياس مهندس ماريو يكارى انضم اتحاد اربع اند جنو تورينيز انترناسيونال دى تورينو جيمناستي سوسايت اوف تورينو، اي ثلاث اند مدين تورينو ناد احد جنوه، اقيم بطول مدين تورينو مايو في يوم احد قط، فاز ها فريق زاير جنوه، اند ثير وقت، لكن ضلت عدم مشارك سبب خلاف اتحاد ايطال اختار ان تشار دلا طول اقليم محل,82,0.7926829268292683,10.0
